{
  "$schema": "http://json-schema.org/draft-07/schema#",
  "$id": "https://github.com/projectquestorg/AgileFlow/apps/cli/config.schema.json",
  "title": "AgileFlow v4 user config",
  "description": "User-facing configuration for AgileFlow v4. Lives at agileflow.config.json in project root.",
  "type": "object",
  "additionalProperties": false,
  "required": ["version"],
  "properties": {
    "$schema": { "type": "string" },
    "version": {
      "type": "integer",
      "const": 1,
      "description": "Config schema version. Bumped on breaking changes."
    },
    "plugins": {
      "type": "object",
      "description": "Map of plugin-id -> { enabled: bool, settings?: object }. core is always enabled.",
      "additionalProperties": {
        "type": "object",
        "additionalProperties": false,
        "properties": {
          "enabled": { "type": "boolean" },
          "settings": { "type": "object", "additionalProperties": true }
        },
        "required": ["enabled"]
      }
    },
    "hooks": {
      "type": "object",
      "description": "Per-hook-id user overrides applied on top of plugin-supplied defaults.",
      "additionalProperties": {
        "type": "object",
        "additionalProperties": false,
        "properties": {
          "enabled": { "type": "boolean" },
          "timeout": { "type": "integer", "minimum": 0, "maximum": 60000 },
          "skipOnError": { "type": "boolean" }
        }
      }
    },
    "install": {
      "type": "object",
      "additionalProperties": false,
      "description": "Where AgileFlow is installed. Project installs write into the current repository; global installs write under the user's home directory.",
      "properties": {
        "scope": {
          "type": "string",
          "enum": ["project", "global"],
          "description": "Install scope for config, AgileFlow state, and IDE mirrors."
        }
      }
    },
    "behaviors": {
      "type": "object",
      "description": "Curated behavior presets. Each maps to one or more hooks the installer wires up. Disabling a behavior excludes its hooks from the generated hook-manifest.yaml.",
      "additionalProperties": false,
      "properties": {
        "loadContext": {
          "type": "boolean",
          "description": "SessionStart: print project context (stories, dirty files, recent commits) for Claude to consume."
        },
        "babysitDefault": {
          "type": "boolean",
          "description": "SessionStart: inject the babysit-mentor pattern so Claude defaults to mentor mode without explicit invocation."
        },
        "damageControlBash": {
          "type": "boolean",
          "description": "PreToolUse: block dangerous Bash commands (rm -rf /, fork bombs, etc.)."
        },
        "damageControlEdit": {
          "type": "boolean",
          "description": "PreToolUse: block risky Edit operations on sensitive paths (.env, .ssh/, etc.)."
        },
        "damageControlWrite": {
          "type": "boolean",
          "description": "PreToolUse: block risky Write operations on sensitive paths (.env, .ssh/, etc.)."
        },
        "preCompactState": {
          "type": "boolean",
          "description": "PreCompact: capture story IDs, active command, and dirty git state so they survive Claude's compaction summary."
        }
      }
    },
    "learnings": {
      "type": "object",
      "additionalProperties": false,
      "description": "Global on/off for the skill self-improvement system. When false, install-time scaffolding is skipped and no learnings hint is injected into the session prompt.",
      "properties": {
        "enabled": { "type": "boolean" }
      }
    },
    "ide": {
      "type": "object",
      "additionalProperties": false,
      "properties": {
        "primary": {
          "type": "string",
          "enum": ["claude-code", "cursor", "windsurf", "codex", "antigravity"],
          "description": "Deprecated alias for targets[0]; kept for back-compat with prior alphas."
        },
        "targets": {
          "type": "array",
          "minItems": 1,
          "uniqueItems": true,
          "items": {
            "type": "string",
            "enum": [
              "claude-code",
              "cursor",
              "windsurf",
              "codex",
              "antigravity"
            ]
          },
          "description": "IDEs / CLIs to install AgileFlow surface into (skills, hooks, settings)."
        }
      }
    },
    "language": {
      "type": "string",
      "description": "IETF BCP 47 language tag (e.g. 'en', 'es', 'pt-BR').",
      "pattern": "^[a-z]{2}(-[A-Z][a-zA-Z0-9]+)?$"
    }
  }
}
